{
  "schemaVersion": 1,
  "keyId": "lexedge-prod-2026",
  "algorithm": "Ed25519",
  "payload": "eyJjaGFubmVsIjoic3RhYmxlIiwiY29tcG9uZW50cyI6W3siYXJjaGl0ZWN0dXJlIjoiYXJtNjQiLCJhdXRoZW50aWNvZGVSZXF1aXJlZCI6ZmFsc2UsImlkIjoib2xsYW1hIiwibGljZW5zZSI6Ik1JVCIsIm1pbmltdW1Pc1ZlcnNpb24iOiIxMS4wIiwibm90aWNlUGF0aCI6Im5vdGljZXMvb2xsYW1hLUxJQ0VOU0UudHh0IiwicGxhdGZvcm0iOiJtYWNvcyIsInJvbGxiYWNrVmVyc2lvbiI6bnVsbCwic2hhMjU2IjoiMzQyZGIwM2RmODBiYjlkYjg0ZmY2NDI0NjAzMWJkNWY3MGMwOWI1OWZmNTJmYTVjYzlhYWFlMzQ3NmNjNGE5ZCIsInNpemVCeXRlcyI6MTU5MjM2MzM3LCJ1cmwiOiJodHRwczovL2dpdGh1Yi5jb20vb2xsYW1hL29sbGFtYS9yZWxlYXNlcy9kb3dubG9hZC92MC4zMy4zL29sbGFtYS1kYXJ3aW4udGd6IiwidmVyc2lvbiI6IjAuMzMuMyJ9LHsiYXJjaGl0ZWN0dXJlIjoieDY0IiwiYXV0aGVudGljb2RlUmVxdWlyZWQiOmZhbHNlLCJpZCI6Im9sbGFtYSIsImxpY2Vuc2UiOiJNSVQiLCJtaW5pbXVtT3NWZXJzaW9uIjoiMTEuMCIsIm5vdGljZVBhdGgiOiJub3RpY2VzL29sbGFtYS1MSUNFTlNFLnR4dCIsInBsYXRmb3JtIjoibWFjb3MiLCJyb2xsYmFja1ZlcnNpb24iOm51bGwsInNoYTI1NiI6IjM0MmRiMDNkZjgwYmI5ZGI4NGZmNjQyNDYwMzFiZDVmNzBjMDliNTlmZjUyZmE1Y2M5YWFhZTM0NzZjYzRhOWQiLCJzaXplQnl0ZXMiOjE1OTIzNjMzNywidXJsIjoiaHR0cHM6Ly9naXRodWIuY29tL29sbGFtYS9vbGxhbWEvcmVsZWFzZXMvZG93bmxvYWQvdjAuMzMuMy9vbGxhbWEtZGFyd2luLnRneiIsInZlcnNpb24iOiIwLjMzLjMifSx7ImFyY2hpdGVjdHVyZSI6Ing2NCIsImF1dGhlbnRpY29kZVJlcXVpcmVkIjp0cnVlLCJpZCI6Im9sbGFtYSIsImxpY2Vuc2UiOiJNSVQiLCJtaW5pbXVtT3NWZXJzaW9uIjoiMTAuMC4xOTA0MSIsIm5vdGljZVBhdGgiOiJub3RpY2VzL29sbGFtYS1MSUNFTlNFLnR4dCIsInBsYXRmb3JtIjoid2luZG93cyIsInJvbGxiYWNrVmVyc2lvbiI6bnVsbCwic2hhMjU2IjoiNTJjYjM2YTYyZTdlNTAxZjYxNTE0ZjYwMjEyZGVjNzExN2I2YzA5ODgxMTM1NzU4NWUwMmZmZmUzMmQyZmNkNyIsInNpemVCeXRlcyI6MTQ2OTE3NTkwMCwidXJsIjoiaHR0cHM6Ly9naXRodWIuY29tL29sbGFtYS9vbGxhbWEvcmVsZWFzZXMvZG93bmxvYWQvdjAuMzMuMy9vbGxhbWEtd2luZG93cy1hbWQ2NC56aXAiLCJ2ZXJzaW9uIjoiMC4zMy4zIn0seyJhcmNoaXRlY3R1cmUiOiJhcm02NCIsImF1dGhlbnRpY29kZVJlcXVpcmVkIjp0cnVlLCJpZCI6Im9sbGFtYSIsImxpY2Vuc2UiOiJNSVQiLCJtaW5pbXVtT3NWZXJzaW9uIjoiMTAuMC4xOTA0MSIsIm5vdGljZVBhdGgiOiJub3RpY2VzL29sbGFtYS1MSUNFTlNFLnR4dCIsInBsYXRmb3JtIjoid2luZG93cyIsInJvbGxiYWNrVmVyc2lvbiI6bnVsbCwic2hhMjU2IjoiOThiOWRkYWFiNmJhZWNlMDQxOGM2ZDEyMzE1MjZlYjFlNGU2Njk0NDk4NWUwYThlZWI3ZDYxNzFiY2Q3YjZkOCIsInNpemVCeXRlcyI6MjEwNjQ4NjM3LCJ1cmwiOiJodHRwczovL2dpdGh1Yi5jb20vb2xsYW1hL29sbGFtYS9yZWxlYXNlcy9kb3dubG9hZC92MC4zMy4zL29sbGFtYS13aW5kb3dzLWFybTY0LnppcCIsInZlcnNpb24iOiIwLjMzLjMifV0sImV4cGlyZXNBdCI6IjIwMjctMDktMjVUMDA6MDA6MDBaIiwiaXNzdWVkQXQiOiIyMDI2LTA5LTI1VDA5OjM5OjI1WiIsInJlbGVhc2VJZCI6InByb2QtMjAyNi0wOS0yNSIsInNjaGVtYVZlcnNpb24iOjF9",
  "signature": "41McR1dZufbge0RNhqLqisU9ghH2BMEUdKwczab6QnuxX2SST9bH9bn6VG1rfQ2Nqua12+bHc2+4c5LkDSDqCA=="
}
