{
  "schemaVersion": 1,
  "keyId": "lexedge-prod-2026",
  "algorithm": "Ed25519",
  "payload": "eyJjYXRhbG9ndWUiOnsiaWQiOiJsZWdhbC1kZXNrdG9wIiwicHJvZmlsZXMiOlt7ImRvd25sb2FkU2l6ZUdiIjo0LjkyLCJleHBlY3RlZERpZ2VzdCI6IjQ2ZTBjMTBjMDM5ZTAxOTExOTMzOTY4N2MzYzE3NTdjYzgxYjlkYTQ5NzA5YTNiMzkyNDg2M2JhODdjYTY2NmUiLCJleHBlY3RlZFNpemVCeXRlcyI6NDkyMDc1Mjg0MSwiZnJpZW5kbHlOYW1lIjoiTGVnYWwgQ29tcGFjdCIsImlkIjoibGVnYWwtY29tcGFjdCIsImxlZ2FsQmVuY2htYXJrIjp7ImFwcHJvdmVkIjp0cnVlLCJzY29yZSI6NjAsInZlcnNpb24iOiJsZXhlZGdlLWxlZ2FsLWJlbmNoLTEifSwibGxtZml0QWxpYXNlcyI6WyJsbGFtYTMuMS04YiJdLCJtaW5pbXVtUmFtR2IiOjgsIm1pbmltdW1WcmFtR2IiOjAsIm9sbGFtYU1vZGVsIjoibGxhbWEzLjE6OGIiLCJvcGVyYXRpb25hbENvbnRleHRUb2tlbnMiOjEzMTA3MiwicmVjb21tZW5kZWRSYW1HYiI6MTYsInJlcXVpcmVzR3B1IjpmYWxzZSwidGFyZ2V0VHBzIjoxMn1dLCJzY2hlbWFWZXJzaW9uIjoxLCJ2ZXJzaW9uIjoiMS4wLjAifSwiZGlzYWJsZWRQcm9maWxlcyI6W10sImVtYmVkZGluZ0RpbWVuc2lvbnMiOjc2OCwiZW1iZWRkaW5nRXhwZWN0ZWREaWdlc3QiOiI4NTQ2MjYxOWVlNzIxYjQ2NmM1OTI3ZDEwOWQ0Y2I3NjU4NjE5MDdkNTQxN2I5MTA5Y2FlYmM0ZTYxNDY3OWYxIiwiZW1iZWRkaW5nRXhwZWN0ZWRTaXplQnl0ZXMiOjYyMTg3NTUwMSwiZW1iZWRkaW5nTW9kZWwiOiJlbWJlZGRpbmdnZW1tYTozMDBtIiwibm90QWZ0ZXIiOiIyMDI3LTA5LTIzVDAwOjAwOjAwWiIsInNjaGVtYVZlcnNpb24iOjF9",
  "signature": "ucySPf++F9XSDjzlQKTIC5gZuGkM/XU0Xte5xwqKYlObfZTmj5x8sVtx+8iwtMlLt7R6JdCqT08NLeexQ2S2BQ=="
}
